[
  {
    "id": "scand-wood-low",
    "category": "violation",
    "template": "Слишком мало дерева. Скандинавский стиль требует натуральных материалов (минимум {threshold}, у вас {value}).",
    "severity": "high"
  },
  {
    "id": "scand-form-complex",
    "category": "violation",
    "template": "Формы слишком сложные. Скандинавский стиль любит минимализм и простоту (максимум {threshold}, у вас {value}).",
    "severity": "medium"
  },
  {
    "id": "scand-saturation-high",
    "category": "violation",
    "template": "Слишком яркие цвета. Скандинавский стиль предпочитает спокойные, приглушенные тона (максимум {threshold}, у вас {value}).",
    "severity": "medium"
  },
  {
    "id": "scand-plastic-high",
    "category": "violation",
    "template": "Много пластика. Скандинавский стиль использует натуральные материалы (максимум {threshold}, у вас {value}).",
    "severity": "high"
  },
  {
    "id": "scand-color-cold",
    "category": "violation",
    "template": "Слишком холодные тона. Добавьте теплого уюта (минимум {threshold}, у вас {value}).",
    "severity": "low"
  },
  {
    "id": "success-excellent",
    "category": "success",
    "template": "Великолепно! Комната идеально соответствует скандинавскому стилю.",
    "severity": "high"
  },
  {
    "id": "success-good",
    "category": "success",
    "template": "Хорошая работа! Комната выглядит уютно и стильно.",
    "severity": "medium"
  },
  {
    "id": "tip-more-items",
    "category": "tip",
    "template": "Попробуйте добавить больше предметов для завершенности композиции.",
    "severity": "low"
  },
  {
    "id": "composition-empty",
    "category": "neutral",
    "template": "Комната пуста. Добавьте мебель и свет, чтобы решить дизайнерскую задачу.",
    "severity": "high"
  },
  {
    "id": "composition-too-few-items",
    "category": "violation",
    "template": "Композиция не завершена: нужно минимум {threshold} предмета, сейчас {value}.",
    "severity": "high"
  },
  {
    "id": "composition-missing-seating",
    "category": "violation",
    "template": "Добавьте место для сидения, чтобы гостиная получила функциональный центр.",
    "severity": "high"
  },
  {
    "id": "composition-missing-surface",
    "category": "violation",
    "template": "Добавьте стол или другую рабочую поверхность для завершения сценария гостиной.",
    "severity": "medium"
  },
  {
    "id": "composition-missing-lighting",
    "category": "violation",
    "template": "Добавьте источник света, чтобы композиция комнаты была завершённой.",
    "severity": "medium"
  },
  {
    "id": "composition-missing-storage",
    "category": "violation",
    "template": "Добавьте систему хранения, если она нужна выбранному сценарию комнаты.",
    "severity": "medium"
  },
  {
    "id": "composition-missing-decor",
    "category": "violation",
    "template": "Добавьте декоративный акцент, чтобы связать мебель в цельную композицию.",
    "severity": "low"
  }
]
